,service_type,p-value,direction,inc/dec
257,Updating Information Provided on Original Rental License Application and Printing Rental License,0.0014204269599288161,-4.3,decreased
258,Common Ownership Communities (CCOC) Office Location,9.835760642017582e-07,-4.271428571428571,decreased
259,Contacting Staff Member at the Office of Home Energy Program or Rental Assistance Program,0.0036187976944742142,-4.271428571428571,decreased
260,Real Property Tax Calculation Method,4.8897016272273496e-05,-4.228571428571429,decreased
261,Sign Permit,0.012183500911882536,-4.228571428571429,decreased
262,Definition of Accessory Apartment,9.63370454103866e-06,-4.214285714285714,decreased
263,Montgomery County Recreation Programs for Seniors,0.002538506441799344,-4.171428571428571,decreased
264,City of Gaithersburg Permits,0.009120093635609125,-4.1571428571428575,decreased
265,Employee or Retiree EyeMed Vision Coverage,0.019697989504545554,-4.071428571428571,decreased
266,Change of Address or Phone Number,0.004811322081853027,-4.057142857142857,decreased
267,Status of Health Care Eligibility Units (formerly MAGI and SEU Units) Application  All Three Office Locations,0.01802412239144851,-4.0,decreased
268,Active Montgomery System,6.218666155164043e-05,-3.971428571428571,decreased
269,Request to Re-paint Road Striping or Lane Markings,0.016858038226444595,-3.942857142857142,decreased
270,License Fees for Residential Rental Facilities,0.013346516838961937,-3.9285714285714284,decreased
271,DHCA Housing Code Enforcement Staff Complaint,0.007121970047830817,-3.9142857142857137,decreased
272,DOT Highway Staff Complaint,0.025911685445274592,-3.9000000000000004,decreased
273,Ride On Glenstone Museum Service,0.0013524041896221424,-3.9,decreased
274,ACCESS to Behavioral Health and Crisis Services,0.04483226535897083,-3.885714285714286,decreased
275,Reporting County Vehicle Driving Complaints,0.00010669719394634241,-3.871428571428571,decreased
276,Calculation of Property Tax Credit for Elderly Individuals and Military Retirees,0.04458598546089408,-3.871428571428571,decreased
277,Tree Selection to Replant in the ROW,0.0196974740597403,-3.8,decreased
278,Right of Way or Sediment Control Permit Bond Release,0.03957120656508672,-3.7857142857142865,decreased
279,Special Food Permit License for Temporary Event,0.0009374937041153208,-3.7714285714285714,decreased
280,Call-n-Ride Application or Recertification Application,0.006519258266083405,-3.757142857142858,decreased
281,Report Trash at a Ride-On Bus Stop,0.02698712693148921,-3.685714285714286,decreased
282,Department of Permitting Services Staff Complaint,0.0020606979963358764,-3.6571428571428566,decreased
283,Location and Hours of Operation for the Animal Shelter,0.002162275663031529,-3.6428571428571423,decreased
284,"Office of the County Attorney - Location, Hours of Operation, and Contact Information",0.0011161271384183187,-3.528571428571429,decreased
285,MetroAccess Reduced Fare Program,0.003459936699328545,-3.5142857142857142,decreased
286,Carbon Monoxide Detector General Safety Information,0.0002989480239401885,-3.5,decreased
287,Emergency Management Service (EMS) Transportation Insurance Reimbursement Billing Concerns,0.00407481314056442,-3.5,decreased
288,Application Process for Sign Permits,0.01152521256069411,-3.5,decreased
289,"Termination of case: food stamps, TCA, Medicaid, TDAP - Silver Spring",0.018450426360624963,-3.5,decreased
290,Contacting Sediment Control Inspector to Schedule an Inspection,0.041043112093187506,-3.4571428571428573,decreased
291,Time to Return Security Deposit,0.004545438510951828,-3.457142857142857,decreased
292,Income Support Inquiries for District Office 154,0.011479065094067126,-3.4285714285714284,decreased
293,Commercial Violation/Complaint Investigation,0.026876301793912098,-3.328571428571429,decreased
294,Ride On Fare Media Accepted,6.98597020502026e-05,-3.3142857142857145,decreased
295,Fire Prevention and Code Compliance Violation/Complaint Investigation,0.01916988098402629,-3.242857142857143,decreased
296,Income Supports Caseworker Complaint Germantown Office,0.01252730245799835,-3.2142857142857144,decreased
297,Children's Dental Services - Healthy Smiles,0.010384909596709907,-3.2,decreased
298,7300 Calhoun Place Request for Back Office Response,6.774044357553012e-06,-3.1714285714285717,decreased
299,Description of the Moderately Priced Dwelling Unit (MPDU) Program,0.011365109410093074,-3.128571428571429,decreased
300,Process to Reserve a Public Facility,1.187449978517718e-05,-3.0714285714285716,decreased
301,Maryland Renter's Tax Credit Information and Application,0.004315075999169697,-3.057142857142857,decreased
302,Electrical Permit Requirement for Commercial Low Voltage Work,0.012759758046523944,-3.057142857142857,decreased
303,Adding a Family Member to the Property Deed Title,1.9883171524371936e-06,-3.0428571428571427,decreased
304,Ride On Fare Media Request for Information,0.004261185498225631,-3.0428571428571427,decreased
305,Payment of Bag Tax Collections,0.037882979865657,-2.9857142857142858,decreased
306,Lost Money in Parking Meter,0.000563859152072917,-2.9714285714285715,decreased
307,Employee - Request to Discuss Retirement Benefits,0.031407596481492286,-2.9571428571428573,decreased
308,License Requirement For Room Rental Inside Household,0.008883847039482468,-2.957142857142857,decreased
309,County Employee ID Cards,0.01657181644640611,-2.942857142857143,decreased
310,Abused Persons Program (APP),0.0021838788006316506,-2.928571428571429,decreased
311,Scheduling an Appointment With a Community Use of Public Facilities (CUPF) Scheduler,0.0001463058003539088,-2.9142857142857146,decreased
312,Report a KBA Problem,0.03294670397300473,-2.9000000000000004,decreased
313,Transit Requests or General Inquiries,0.03739639189550689,-2.8428571428571434,decreased
314,"Mechanical Permit Requirement for Replacement of Natural Gas Fired Furnaces, Propane and Natural Gas Appliances",0.008958888418453511,-2.8285714285714287,decreased
315,Employee - Insurance Requirements to Add Dependents,0.04620192192247398,-2.8285714285714287,decreased
316,Required Inspections and Scheduling for Residential Mechanical Equipment Installation,0.01615063165783778,-2.8,decreased
317,Fax numbers for the Office of Human Resources,0.006305836869028409,-2.7714285714285714,decreased
318,Maintenance in County Parking Garages,7.422621340375951e-05,-2.7142857142857144,decreased
319,Apply for Temporary Cash Assistance (TCA) Program - Germantown,0.0184303831244694,-2.7142857142857144,decreased
320,Medicaid Card Lost or Stolen - Rockville,0.021598395449459303,-2.7142857142857144,decreased
321,"Water Pollution in Streams, Rivers, or Other Water Bodies",0.044323108049514406,-2.7,decreased
322,AccessMCG - CSR Reset Password or Unlock Account,0.00044839621390993446,-2.6857142857142855,decreased
323,Fire Alarms Permits - New Construction,0.034712239305050956,-2.6857142857142855,decreased
324,Definition of Front Foot Benefit Charge (FFBC),0.0160075563556835,-2.6714285714285713,decreased
325,"Speed Camera, Red Light Camera Fines",0.02170182622069953,-2.671428571428571,decreased
326,State Highway Administration (SHA) Park and Ride Lots,0.00018704122898319803,-2.6428571428571432,decreased
327,Divorce Decree,0.041415702741940445,-2.628571428571429,decreased
328,"Maternity Partnership Program, Case Management and Education - Germantown",0.01553972223670961,-2.5714285714285716,decreased
329,List of Required Inspections,0.003962922398246393,-2.557142857142857,decreased
330,Locating the Zoning Classification of Property,0.03072328536621131,-2.5428571428571436,decreased
331,Fleet Management Services Information,0.009732427213070098,-2.5142857142857142,decreased
332,Names of Beneficiaries,0.00013201128187673316,-2.5,decreased
333,Apply for Temporary Cash Assistance (TCA) Program - Silver Spring,0.0237163112461607,-2.5,decreased
334,Ride On Monthly Pass on SmarTrip Card,0.0020925308596438786,-2.4857142857142858,decreased
335,TB Symptoms Requiring an Immediate Referral,0.007638553108116273,-2.4714285714285715,decreased
336,Eviction Process after Writ Issued,0.0035538273891090036,-2.4571428571428573,decreased
337,ADA Complaints or Grievances,7.907637131563323e-05,-2.442857142857143,decreased
338,Apply for Temporary Cash Assistance (TCA) Program - Rockville,0.026472091522981404,-2.4285714285714284,decreased
339,Ride On Request for New Bus Service to Areas Where It Does Not Exist,2.4082926194851202e-05,-2.4142857142857146,decreased
340,Montgomery County Public Schools (MCPS) Employee Inquiries for Community Use of Public Facilities (CUPF),2.7598205362745366e-05,-2.4,decreased
341,Forms and Applications Related to Montgomery County Fire Code Compliance,0.015953619733739377,-2.4,decreased
342,Pre-Construction Meeting for Well and Septic Systems Requiring a Well and Septic Permit,0.0013825411232015307,-2.3857142857142857,decreased
343,Montgomery College,0.02820438835701014,-2.371428571428571,decreased
344,Request New Streetlights to be Installed,0.0290143988889642,-2.371428571428571,decreased
345,Unit Inspection Date/Time for a HOC Inspection,0.0008295856488176563,-2.3142857142857145,decreased
346,Children Home Alone,0.0011530881819424982,-2.3142857142857145,decreased
347,Dockless Bikeshare Demonstration Program,0.009764380094607778,-2.3142857142857145,decreased
348,Maryland Department of Health and Mental Hygiene,0.01498634079909689,-2.2857142857142856,decreased
349,Testing a Well,0.04381118270676844,-2.2857142857142856,decreased
350,"Retiree - ID Card for Medical, Dental, Prescription or Vision Plan",0.0174408979300701,-2.2714285714285714,decreased
351,Pay Parking Meter Ticket,0.013861806556443246,-2.2571428571428567,decreased
352,Liquor Control Licensee Questions,0.028175244492924828,-2.2142857142857144,decreased
353,Fugitive or Warrant Unit,0.0004495587632438112,-2.2,decreased
354,Bus Problems,0.005249441207228339,-2.1857142857142855,decreased
355,Mobile Medical Care Walk In Clinics,0.007636456934878794,-2.1714285714285713,decreased
356,ResCare,0.00020570098094145473,-2.1571428571428575,decreased
357,Senior Citizens Real Property Tax Deferral,0.015549374235335294,-2.1571428571428575,decreased
358,Pay Bonds,0.04691481289645998,-2.1428571428571432,decreased
359,Income Support Caseworker Complaint Silver Spring Office,0.01701501664063086,-2.142857142857143,decreased
360,TRiPS Commuter Store,0.005997801641920059,-2.128571428571428,decreased
361,DOT Highway Staff Compliment,0.014463462436659727,-2.128571428571428,decreased
362,Moderately Priced Dwelling Unit (MPDU) Office Location,0.0071872683814518485,-2.1142857142857143,decreased
363,Child and Adolescent Behavioral Health Outpatient Clinic,0.013538491944632901,-2.1,decreased
364,AccessMCG - CSC Unable to Reset Password or Unlock Account,0.01685454956778833,-2.0428571428571427,decreased
365,Medicaid Transportation Program,0.004049734960305753,-2.0285714285714285,decreased
366,Montgomery Avenue Women's Center,0.0013316105379451112,-2.0,decreased
367,Housing Contractor Complaint,0.04522785251579507,-2.0,decreased
368,Free Cell Phone,0.0327775612638151,-1.9857142857142858,decreased
369,First Aid/CPR Lessons,0.0021894301768624305,-1.9857142857142855,decreased
370,EZ Pass,0.015511471685581068,-1.9857142857142855,decreased
371,Employee - Montgomery County Government Exit Procedures,0.024453125304155193,-1.9857142857142855,decreased
372,Family Justice Center (FJC),0.0037096823753034014,-1.9714285714285715,decreased
373,Appealing a Speed Camera Citation,0.020895133911010506,-1.9571428571428569,decreased
374,Park Overnight in Garage,0.00043919118938510305,-1.9428571428571428,decreased
375,Workforce Housing Program,0.0070917700325404285,-1.9285714285714284,decreased
376,Request for Proclamation From the County Executive,5.830286838549109e-05,-1.9142857142857144,decreased
377,"Montgomery County Governement Employees Organization, Local 1994 Union",0.0010096071351757472,-1.9,decreased
378,Explanation of New Traffic Sign on Street,0.029271234709721372,-1.9,decreased
379,How to Become a Child Care Provider,0.0005838441026845411,-1.8857142857142857,decreased
380,Cornerstone Montgomery (formerly Threshold Services),0.0037357330422027914,-1.8857142857142857,decreased
381,Victim Assistance and Sexual Assault Program (VASAP) Offerings,0.0014839550938350542,-1.8714285714285717,decreased
382,Licensee Special Order - Purchasing,0.014591237741707482,-1.8714285714285717,decreased
383,Age at Which Children Can be Left Home Alone,0.012634147057573005,-1.8571428571428572,decreased
384,"Closing an Income Support Food Stamp, TCA, Medicaid, or TDAP Case",0.02369867098269554,-1.8571428571428572,decreased
385,Carryout Bag Law,0.04758115984100311,-1.8571428571428572,decreased
386,Already Registered For MPDU Class But Can't Remember Time or Location,0.0014810040075049556,-1.8428571428571427,decreased
387,Tuition Assistance for County Employees - Application Process,0.00010912453680884524,-1.8285714285714285,decreased
388,Volunteering at a Montgomery County Fire Rescue Department,0.005178790055067483,-1.8285714285714283,decreased
389,Mice Rats or Rodent Complaints in a Restaurant or Other Eating Establishment,0.0018068129251665802,-1.8142857142857145,decreased
390,Accessory Apartment Inspections,0.0005102748250210514,-1.8,decreased
391,Knox Box,0.03458520964810111,-1.8,decreased
392,Patient Navigator Program to Assist the Low Income Latino Community,0.00020555712724933955,-1.7857142857142858,decreased
393,"Hang Up, Dropped Cal or Wrong Number at DLC",0.01746283918208885,-1.7857142857142858,decreased
394,Income Support Office or Supervisor Complaint Germantown,0.027607470033265753,-1.7857142857142858,decreased
395,Viewing or Obtaining Copies of County Code and County Charter,0.0003580478970327436,-1.7857142857142856,decreased
396,Pro-rating of Rental Licensing Fee,0.010849526597344498,-1.7857142857142856,decreased
397,Schedule Fire Alarm Inspections - New Construction,0.0018311626920079955,-1.7714285714285716,decreased
398,County Employee Process for Filing a Discrimination Claim,0.0037777318660288895,-1.7714285714285716,decreased
399,Sample Leases,0.03392343175659963,-1.7714285714285716,decreased
400,Business Hours for the Department of Housing and Community Affairs (DHCA) Housing Code Enforcement Unit,0.009273336541421819,-1.7571428571428571,decreased
401,Ride On Fare Purchase SmarTrip Cards and Load Value,0.0007045918736312537,-1.7428571428571429,decreased
402,New Curb Request,0.006865248772862024,-1.7428571428571429,decreased
403,Ride On Bus Stop Park and Ride Lots,0.000493241377614695,-1.7142857142857144,decreased
404,ChildLink Early Childhood Services,0.014619284504286813,-1.7142857142857144,decreased
405,Noise Waiver,0.02711007954088178,-1.7142857142857144,decreased
406,Alert Montgomery - Unsubscribe to Email or Text Alerts,0.028438232564474804,-1.7142857142857144,decreased
407,Radon Testing Law,0.03137847618294718,-1.6714285714285717,decreased
408,Medicaid Card Lost or Stolen - Germantown,0.02241779679965019,-1.6428571428571428,decreased
409,"General Information about Types of Stormwater Management (Ponds, Underground Structures, Dry Ponds, Wetlands, Detention Basins, LID, ESD, Bioretention)",0.02393962259904029,-1.6428571428571428,decreased
410,Physician or Other Medical Personnel Reporting TB Case,0.014788041015075228,-1.6285714285714286,decreased
411,Family Medicaid MCHP Application Processing Time - All Three Health Care Eligibility Units (formerly MAGI and SEU Offices),0.03162845470537637,-1.6285714285714283,decreased
412,Montgomery County Executive Staff and Directors,0.0007563960508741729,-1.6142857142857143,decreased
413,Restaurant Inspection Results,0.0013715740960038557,-1.6142857142857143,decreased
414,Procedure to Apply for Internship,0.0018048805291995325,-1.614285714285714,decreased
415,The Opioid Crisis and the Drug Narcan or Naloxone,0.00027804724054911157,-1.6,decreased
416,AccessMCG (iRecruitment) - Information Required to Complete Job Application,0.0030867862923226602,-1.6,decreased
417,Unsolicited Phone Calls Demanding Money,0.00875352204226329,-1.6,decreased
418,Montgomery County Government Workers' Compensation,0.009768914089735653,-1.6,decreased
419,Confirm a Notice of Eviction,0.023499365606955026,-1.6,decreased
420,AccessMCG External (iRecruitment) - Computer Requirements to Submit Employment Application,0.016799991019739467,-1.5714285714285716,decreased
421,Access to Online Training Catalog,0.0013205404208573134,-1.5571428571428572,decreased
422,Maryland Department of Juvenile Services,0.01302075092776285,-1.5428571428571427,decreased
423,Rabies Vaccine for Human Beings,0.0020028552832234326,-1.5285714285714285,decreased
424,"Report an Untagged, Abandoned, Dysfunctional, or Inoperable Vehicle on Residential Private Property",0.01443950896052029,-1.5285714285714285,decreased
425,Indoor Air Quality,0.0006794627477567704,-1.5142857142857142,decreased
426,Physical Address for the Office of the County Executive,0.000766585240031385,-1.5,decreased
427,Maryland State Department of Education of Maryland Office of Child Care,0.001491311112961217,-1.5,decreased
428,Project Reboot,0.001491311112961217,-1.5,decreased
429,DataMontgomery Website,0.00016759978056774425,-1.4857142857142858,decreased
430,Employment with Fire and Rescue Service,0.0005706401973292732,-1.4857142857142858,decreased
431,Ride On Request for Later or Earlier Bus Service Hours to be Added to Existing Routes,0.0034926510125263253,-1.4857142857142858,decreased
432,Speaker Request for Residential County Trash or Recycling Programs,0.002517086341839642,-1.4571428571428573,decreased
433,Avery Road Treatment Center,0.0058131011666305256,-1.4571428571428573,decreased
434,Marriage Certificate and Divorce Decree,0.017664643207750047,-1.4571428571428569,decreased
435,Obtain a Montgomery County Permit for Hazardous Materials,0.0007296903520099057,-1.4428571428571428,decreased
436,Housing Code Enforcement Process,0.04748978754168861,-1.4428571428571426,decreased
437,AccessMCG (FIN Payroll) - Employee Didn't Receive or Can't Find Letter With Temporary Login ID & Temporary Password,0.0015652166937124433,-1.4285714285714286,decreased
438,Requirements for Becoming a Foster and/or Adoptive Parent,0.01803677985464035,-1.4285714285714284,decreased
439,Licensee Credits,0.012407950227321966,-1.4142857142857141,decreased
440,Random Selection Drawing Results For MPDU Sales,0.006802177826898858,-1.4,decreased
441,Contact the County Attorney's Office Regarding a Code Enforcement Issued Citation or Upcoming Court Date,0.0028606459743246333,-1.3857142857142857,decreased
442,"Montgomery County Police Department, Security Services Division Office Location and Contact Information",0.018069429924325732,-1.3857142857142857,decreased
443,Storm Water Management Concept,0.020406771509596314,-1.3857142857142857,decreased
444,Interior Maintenance of Commercial Properties,0.013153322896521016,-1.3714285714285717,decreased
445,Pay by Cell Park Now Parking System,0.0017311564301489971,-1.3714285714285714,decreased
446,Ride On Request for Camera Footage,0.01218245810678038,-1.3571428571428572,decreased
447,Medical Transportation Program Application Submission,0.015186439127952856,-1.3571428571428572,decreased
448,Apply for Temporary Disability Assistance Program or TDAP Rockville,0.04374110742764728,-1.3571428571428572,decreased
449,Immediate Need for Car Seat Inspection Appointment,0.004384131570348814,-1.3285714285714287,decreased
450,Specialized Medical Care Montgomery Cares,0.04591224497973975,-1.3285714285714287,decreased
451,Notice of Violation Received from The Licensing and Registration Office,0.041068601308431714,-1.3285714285714285,decreased
452,New Residential Permit Parking Area,0.04473184702670502,-1.3285714285714283,decreased
453,Questions about Cannabis (Marijuana) in the State of Maryland,0.003436896596673244,-1.314285714285714,decreased
454,Emergency Building Inspections by the Department of Permitting Services (DPS),0.0038356174534912493,-1.314285714285714,decreased
455,County Land or Building For Lease or Sale,0.039081001484495344,-1.3,decreased
456,Vehicles  for Change - Maryland Transportation Program,0.04002055009703144,-1.3,decreased
457,Transfer Call to 911,0.001528357188474735,-1.2857142857142858,decreased
458,Missing Person,0.001968301904753812,-1.2857142857142858,decreased
459,Apply for Temporary Disability Assistance Program (TDAP) -  Silver Spring,0.022436367477147192,-1.2857142857142858,decreased
460,Apply for Temporary Disability Assistance Program (TDAP) - Germantown,0.03295069731535819,-1.2857142857142858,decreased
461,Montgomery County Correctional Facility and Detention Center Visiting Hours,0.017549137491628553,-1.2857142857142856,decreased
462,Fuel Energy Tax Information,0.0010336167778159443,-1.2714285714285714,decreased
463,MCGEO Members Sick Leave Bank,0.00870641713288393,-1.2571428571428571,decreased
464,Obtaining Guardianship of a Child,0.01727700501588493,-1.2571428571428571,decreased
465,Employee - Voluntary Short Term Disability,0.027058934616325674,-1.2571428571428571,decreased
466,Fire Hydrant Maintenance,0.03166440417333418,-1.2571428571428571,decreased
467,Enforcement Cameras and Speed to Trigger Citation,0.0025003170552659213,-1.2428571428571429,decreased
468,Damage to Personal Property by Fire and Rescue Services,0.002942517322923762,-1.2428571428571429,decreased
469,"Employee, Retiree and Participating Agency - Insurance Claims Issues",0.03610760943585771,-1.2428571428571429,decreased
470,Screening and Assessment Services for Children and Adolescents SASCA,0.019490441925671804,-1.2142857142857144,decreased
471,Flu Clinic Appointments 2018 2019 Season,0.02020116308091096,-1.2142857142857142,decreased
472,Employee - LiveWell and Virgin Pulse Program Information,0.020404301039845054,-1.2142857142857142,decreased
473,Medicaid Card Lost or Stolen - Silver Spring,0.03172573117768999,-1.2142857142857142,decreased
474,Lawn Care Law,0.04132764528708303,-1.2142857142857142,decreased
475,Vehicle Lockouts,0.01926211913383783,-1.185714285714286,decreased
476,Employee - Requests  Copy of Pay Advice (Payslip),0.0029951633190497015,-1.1857142857142857,decreased
477,Panhandling Enforcement,0.023506424446702073,-1.1857142857142855,decreased
478,How to Reach a Case Worker in Child Foster Care,0.02485293432633877,-1.1714285714285717,decreased
479,Obtain a Copy of an Accident Report,0.019291356312696885,-1.1571428571428573,decreased
480,Travel Vaccines for Children,0.04815751371983851,-1.1571428571428573,decreased
481,Renewal of MPDU Certificate,0.02940290627944067,-1.1428571428571428,decreased
482,Department of Liquor Control Hours of Operation,0.04009291264774772,-1.1428571428571428,decreased
483,Domestic Partnership Health Insurance,0.032346821239250284,-1.114285714285714,decreased
484,Metro Disability ID Card,0.014088649093274019,-1.1,decreased
485,Rabies Shot or Vaccine After Animal Bite,0.016259046974551935,-1.1,decreased
486,Passport Application,0.0026359216743590285,-1.0857142857142859,decreased
487,CCOC Community Association Manual and Resource Guide,0.0055363410723658114,-1.0857142857142859,decreased
488,Health and Human Services Guide to the Community or Request HHS Presence at a Health Fair or Event,0.013722761088137374,-1.0857142857142859,decreased
489,General Wage Adjustment Fiscal Year 2019,0.01545466990758564,-1.0714285714285714,decreased
490,Tdap or Tetanus-Diptheria-Acellular Pertussis Vaccination and Meningococcal or MCV4 Vaccination  School Year 2018 2019,0.018635566715349473,-1.0714285714285714,decreased
491,Duration of Eviction Process,0.022334894418893962,-1.0714285714285714,decreased
492,Welfare Avoidance Grant or WAG,0.02301639848520162,-1.0714285714285714,decreased
493,County Assistance for Stream Erosion Problems on Private Property,0.02565681279306738,-1.0714285714285714,decreased
494,"Stormwater Management (Ponds, Underground Structures, Dry Ponds, Wetlands, Detention Basins)",0.02565681279306738,-1.0714285714285714,decreased
495,Housing Choice Voucher With Moderately Priced Dwelling Unit (MPDU) Rental Units,0.029742442696311686,-1.0714285714285714,decreased
496,Income Support Office or Supervisor Complaint Rockville,0.03748029378144063,-1.0714285714285714,decreased
497,Payment of Outstanding Parking Meter Violations,0.0027952284851338934,-1.0571428571428572,decreased
498,Shepherd's Table,0.0230066911927442,-1.0571428571428572,decreased
499,Disabled Vehicle,0.041785348253175716,-1.0571428571428572,decreased
500,Wrong Product Delivered,0.02082860466394785,-1.0428571428571427,decreased
501,Parking Ticket Enforcement Officer Complaint,0.010630542670496896,-1.0142857142857142,decreased
502,Montgomery County Office of Budget and Management - Budget Information,0.018962098753140505,-1.0142857142857142,decreased
503,Montgomery County Recreation Facility Complaints,0.027059630222185018,-1.0142857142857142,decreased
504,General Information about Stormwater Facility Maintenance,0.004997920132095667,-1.0,decreased
505,"Bed Bugs in Private Homes, Hotels or Motels",0.007526519797131049,-1.0,decreased
506,"Transfer an Income Support Case to Another Jurisdiction in Maryland, Silver Spring Office",0.016418660102918054,-1.0,decreased
507,Upcounty Community Events,0.027070222572118177,-0.9857142857142858,decreased
508,Notification to Tenant for Retention of Security Deposit by Landlord,0.042134672377166824,-0.9857142857142858,decreased
509,Eligibility Requirements for Montgomery County Recreation Financial Assistance,0.003449152807180887,-0.9714285714285714,decreased
510,Silver Spring - Urban District,0.04198400605079775,-0.9714285714285714,decreased
511,"Pedestrian, Bicycle, Traffic and Safety Advisory Committee",0.006412424853139124,-0.9571428571428572,decreased
512,Retiree - Cobra Claims Issue,0.023763888479532338,-0.9571428571428572,decreased
513,English Classes in Silver Spring,0.04092210497094722,-0.9571428571428572,decreased
