,service_type,p-value,direction,inc/dec
514,Benefit Strategies Email Error,0.04977309768827864,-0.9571428571428572,decreased
515,Received Parking Ticket with Time Left on Meter,0.012686989874283162,-0.9428571428571428,decreased
516,Tree Crew Removed Tree but Stem or Trunk Remains,0.02588473976490352,-0.9428571428571428,decreased
517,Contractor or Company Recommendation,0.033751580723762054,-0.9428571428571428,decreased
518,MPIA Departmental Contacts,0.006423764678911278,-0.9285714285714286,decreased
519,"Questions Related to a Specific Press Release, Press Event, or Statement From County Executive",0.006423764678911278,-0.9285714285714286,decreased
520,Medical Examiner,0.01290987403663316,-0.9285714285714286,decreased
521,Employee 2019 Health Care Flexible Spending Account,0.01691158943531134,-0.9285714285714286,decreased
522,Employment Resources for People 50 Years and Older,0.04545997102384862,-0.9285714285714286,decreased
523,Local Small Business Reserve Program,0.016705113300148764,-0.9142857142857141,decreased
524,Responsibility of Alarm Company to Reduce False Alarms,0.021262800375157296,-0.9142857142857141,decreased
525,Sprinkler Installation,0.011059412125611073,-0.9,decreased
526,State Traffic Cameras,0.011059412125611073,-0.9,decreased
527,Classes on How to Start a Business,0.01989649465554376,-0.9,decreased
528,Length of Time to Obtain a Commercial Building Permit,0.027584950731523866,-0.9,decreased
529,Ride On Fare Montgomery College Students Ride Free,0.0013451578155393793,-0.8714285714285714,decreased
530,AccessMCG (FIN Payroll) - Employees with Single Sign On Access,0.005494892727055115,-0.8714285714285714,decreased
531,Challenging Automated Traffic Enforcement Citations Received Weeks After the Alleged Incident,0.002619222995018495,-0.8571428571428571,decreased
532,Employee - BCBS Blue Choice Advantage Network,0.008088745097244983,-0.8571428571428571,decreased
533,Request Fire Rescue Staff at Event or Speaking Engagement,0.014467071115937771,-0.8428571428571427,decreased
534,Office of Community Partnerships,0.03888917735848768,-0.8428571428571427,decreased
535,Request New Guardrail,0.014778348522469434,-0.8285714285714286,decreased
536,Raising or Lowering Speed Limit,0.033094446215280404,-0.8285714285714286,decreased
537,Job Opportunities with Montgomery County Public Schools,0.033094446215280425,-0.8285714285714286,decreased
538,Montgomery County's Position on U.S. Immigration and Customs Enforcement (ICE),0.04742145119355595,-0.8285714285714286,decreased
539,Health Care Eligibility Unit  (former Service Eligibility and MAGI Unit)s Case Worker Complaint Rockville,0.04742145119355595,-0.8285714285714286,decreased
540,Automatic Fire Sprinklers in Homes,0.010249241381594538,-0.8142857142857142,decreased
541,Moderately Priced Dwelling Unit (MPDU) Program Income Limits,0.034396348123410636,-0.8142857142857142,decreased
542,Taxi Order or Schedule,0.0417914701148291,-0.8142857142857142,decreased
543,"Caller Unable to Reach MC311 by Dialing ""3-1-1""",0.017956570252681717,-0.8,decreased
544,Air Conditioning Requirement in a Rental Dwelling,0.0467624320288232,-0.8,decreased
545,Montgomery County Government Employee - Recreation Total REC Pass and Family All Pool Pass,0.0028453372865030447,-0.7857142857142857,decreased
546,Montgomery County School Crossing Guards,0.009940570934265723,-0.7857142857142857,decreased
547,Longevity Increment Fiscal Year 2019,0.015102513211987176,-0.7857142857142857,decreased
548,Census Jobs,0.015102513211987176,-0.7857142857142857,decreased
549,Carbon Monoxide Detectors In Rental Units,0.02115086743380992,-0.7857142857142857,decreased
550,Manual J Calculations for a Residential Mechanical Permit,0.01443687446636831,-0.7714285714285714,decreased
551,General Information for Pending Evictions,0.04421753223525981,-0.7714285714285714,decreased
552,Maximum Occupancy for BEDROOM,0.02555565534729627,-0.7571428571428572,decreased
553,Taxable Levy Year,0.0038267441135582453,-0.7571428571428571,decreased
554,Commission on Aging,0.007757190562661395,-0.7571428571428571,decreased
555,Use Silver Spring Civic Building at Veterans Plaza,0.01304963777596548,-0.7571428571428571,decreased
556,City of Rockville Senior Center,0.013049637775965486,-0.7571428571428571,decreased
557,Residential Kitchen Range Hoods,0.013049637775965486,-0.7571428571428571,decreased
558,Participating Agency Employee - Verify Health Insurance Coverage,0.026838260056238728,-0.7571428571428571,decreased
559,Commuter Services Program,0.03488593104493889,-0.7571428571428571,decreased
560,Finding Child Care Providers,0.005581537935852895,-0.7285714285714286,decreased
561,Methadone Clinic in Montgomery County,0.024626530103540684,-0.7285714285714286,decreased
562,AccessMCG - Can't Remember or Forgot Login ID,0.006477588958467389,-0.7142857142857143,decreased
563,Frequency of Housing Code Enforcement Multi-family Inspections,0.006477588958467389,-0.7142857142857143,decreased
564,Office of Health Care Quality Licensing,0.011838028025660799,-0.7142857142857143,decreased
565,Silver Spring Vet Center,0.01863556671534945,-0.7142857142857143,decreased
566,Site Plans are Required with a Sediment Control Permit Application or a Public Right of Way Permit Application,0.04489612348358556,-0.7142857142857143,decreased
567,Soliciting,0.02919350629615885,-0.7,decreased
568,"Montgomery County Cancer Crusade, Nicotine Tobacco Cessation",0.02299141993961756,-0.657142857142857,decreased
569,Next Step in the MPDU Home Ownership Program Following Completion of the MPDU Orientation Seminar,0.03339240007273216,-0.657142857142857,decreased
570,Family Medicaid Appeal Process - All Three Health Care Eligibility Units (formerly MAGI and SEUs),0.04480307309760034,-0.657142857142857,decreased
571,Accessory Apartment Public Notice Sign,0.022436367477147192,-0.6428571428571429,decreased
572,Controlled Dangerous Substance (CDS),0.03295069731535819,-0.6428571428571429,decreased
573,Stormwater Facility Maintenance,0.04453630670024999,-0.6428571428571429,decreased
574,Report a Broken Web-Link,0.029307373807641566,-0.6285714285714286,decreased
575,OHR and MC311 Partnership,0.020803266766772625,-0.6142857142857143,decreased
576,Residential Parking Description,0.032519305212186864,-0.6142857142857143,decreased
577,Business Hours for the Moderately Priced Dwelling Unit (MPDU) Program,0.034265434662139556,-0.6,decreased
578,Ride On Advertise on Buses or Bus Shelter,0.01837769265277821,-0.5857142857142856,decreased
579,Maryland's Commitment to Veterans,0.01837769265277821,-0.5857142857142856,decreased
580,Navigation of Department of Recreation Website,0.030674917096995238,-0.5857142857142856,decreased
581,Residential Permit for Overnight Guests to Park,0.030674917096995245,-0.5857142857142856,decreased
582,Solar Panel Financing,0.04482062340997801,-0.5857142857142856,decreased
583,New County Building Design and Construction Information,0.005652526562219237,-0.5714285714285714,decreased
584,Retiree - Long Term Care Insurance,0.005652526562219237,-0.5714285714285714,decreased
585,AccessMCG (FIN Payroll) - Employees Using Email Addresses as Logins,0.014233416415981366,-0.5714285714285714,decreased
586,CharmCard,0.014233416415981375,-0.5714285714285714,decreased
587,Personnel Management Review Report,0.02606319337636288,-0.5714285714285714,decreased
588,Smoke Detectors in a Rental Unit,0.02606319337636288,-0.5714285714285714,decreased
589,Allowed Uses of Public Space,0.04009291264774772,-0.5714285714285714,decreased
590,Definition of Washington Suburban Sanitary Commission (WSSC) Remainder,0.04093906615265313,-0.5571428571428572,decreased
591,Capital Bikeshare in Montgomery County,0.02502926127632557,-0.5428571428571429,decreased
592,Pro bono Consultant Volunteer Program,0.04100071449036981,-0.5428571428571429,decreased
593,Permanent Visitor Permit,0.04100071449036981,-0.5428571428571429,decreased
594,American Flag Display and Disposal,0.04100071449036981,-0.5428571428571429,decreased
595,Reason for Parking Ticket,0.04028222335051196,-0.5142857142857142,decreased
596,M-NCPPC Nature Centers,0.012986865174166692,-0.5,decreased
597,Community Use Fees,0.012986865174166692,-0.5,decreased
598,Pay by Cell Ticket Issued,0.012986865174166692,-0.5,decreased
599,Recovered Vehicle,0.012986865174166692,-0.5,decreased
600,West Nile Virus,0.012986865174166692,-0.5,decreased
601,Kind and Gentle Dental Care,0.02850443458794701,-0.5,decreased
602,Court Ordered Supervised Visits with Child,0.04749054615278071,-0.5,decreased
603,Termination of Food Stamps TCA Medicaid or TDAP How to Appeal or Overpayment,0.04749054615278071,-0.5,decreased
604,Services Offered at the Family Justice Center,0.04749054615278071,-0.5,decreased
605,Payment Options and Requirements for Recreation Class Registration,0.04749054615278071,-0.5,decreased
606,Wheaton Urban District,0.0284462264392816,-0.4714285714285714,decreased
607,Required Documents When Obtaining an Electrical Permit,0.028446226439281623,-0.4714285714285714,decreased
608,Ride On Public Service Ad Display,0.027531588210939227,-0.42857142857142855,decreased
609,Reaching DHCA Staff for Urgent Matters,0.027531588210939227,-0.42857142857142855,decreased
610,Discount for Phone Services for County Employees,0.027531588210939227,-0.42857142857142855,decreased
611,Pay-by-Space Parking,0.027531588210939227,-0.42857142857142855,decreased
612,Solicitors Permit (County and State),0.027531588210939227,-0.42857142857142855,decreased
613,Location of the  East County Regional Service Center (RSC),0.028972186848166527,-0.4,decreased
614,On-line Citizen Reporting System (CRS),0.01863556671534945,-0.35714285714285715,decreased
615,TB Test for Pregnant Women,0.01863556671534945,-0.35714285714285715,decreased
616,COB Garage Renovations,0.01863556671534945,-0.35714285714285715,decreased
617,Restaurants' Exemption for the Carryout Bag Law,0.01863556671534945,-0.35714285714285715,decreased
618,GET-IN (Government Employee Transit Incentives) Program,0.01863556671534945,-0.35714285714285715,decreased
619,Frequency of County Job Fairs,0.01863556671534945,-0.35714285714285715,decreased
620,Call-n-Ride Changes to Swipe Card Accounts,0.01863556671534945,-0.35714285714285715,decreased
621,Furnace Repair or Replacement,0.01863556671534945,-0.35714285714285715,decreased
622,Mental Health Case Management Services,0.01863556671534945,-0.35714285714285715,decreased
623,Verification for Medicaid for families or Medical Assistance for Children,0.040092912647747704,-0.2857142857142857,decreased
624,Blasting Complaint,0.040092912647747704,-0.2857142857142857,decreased
625,Call-n-Ride Payment Options and Mailing Address,0.040092912647747704,-0.2857142857142857,decreased
626,Lost Procurement Central Vendor Registration System Password,0.040092912647747704,-0.2857142857142857,decreased
627,Vaccines or Immunizations for Immigration Purposes,0.040092912647747704,-0.2857142857142857,decreased
628,Dissatisfaction with Montgomery County Recreation Program,0.040092912647747704,-0.2857142857142857,decreased
629,AccessMCG (iRecruitment) - Employment Application Submission Deadline on Closing Date,0.040092912647747704,-0.2857142857142857,decreased
630,Elder or Senior Care Locator Nationwide,0.040092912647747704,-0.2857142857142857,decreased
631,Questions About the Data on the DataMontgomery Website,0.040092912647747704,-0.2857142857142857,decreased
632,Retiree - Insurance Claim Form,0.040092912647747704,-0.2857142857142857,decreased
633,Cost of Required MPDU Classes,0.040092912647747704,-0.2857142857142857,decreased
634,Landlord Missing Recent Housing Opportunities Commission (HOC) Rent Payment,0.040092912647747704,-0.2857142857142857,decreased
635,Library Compliments,0.040092912647747704,-0.2857142857142857,decreased
636,Location of the Upcounty Regional Service Center (RSC),0.040092912647747704,-0.2857142857142857,decreased
637,Assault/Battery,0.040092912647747704,-0.2857142857142857,decreased
638,Taxi Fees,0.040092912647747704,-0.2857142857142857,decreased
639,Vision Zero Initiative,0.040092912647747704,-0.2857142857142857,decreased
640,Liquor Store Locations and Hours of Operation,0.040092912647747704,-0.2857142857142857,decreased
641,Height Restrictions for Yard Sign on Private Residential Property,0.040092912647747704,-0.2857142857142857,decreased
642,Cost of Parking in Wheaton,0.040092912647747704,-0.2857142857142857,decreased
643,Youth Substance Usage and Mental Health Screenings,0.040092912647747704,-0.2857142857142857,decreased
644,Services  Provided by the Payment of Montgomery County Property Taxes,0.040092912647747704,-0.2857142857142857,decreased
645,Age/Size When Child Should Start Riding in Forward-Facing Car Seat,0.03678749787978613,0.4,increased
646,Pet Waste Management Program,0.03678749787978613,0.4,increased
647,ABS Delivery Truck Damaged Property,0.03678749787978613,0.4,increased
648,Council News Releases,0.03678749787978613,0.4,increased
649,Home Health Aide Licensing and Cerification,0.03531979291199548,0.4285714285714286,increased
650,How To Update Information About an MPDU Certificate of Eligibility for the Sales Program,0.014956363910414203,0.5,increased
651,Employment Opportunities with Montgomery County Department of Police,0.04415353582141624,0.5285714285714286,increased
652,Request to Speak with a Board of Elections (BOE)  Employee,0.04415353582141624,0.5285714285714286,increased
653,Embezzlement,0.04415353582141624,0.5285714285714286,increased
654,Student Request for Volunteer Opportunities or Internships with Local Nonprofits in Montgomery County,0.04415353582141624,0.5285714285714286,increased
655,Connecting to a New or Existing Water/Sewer Line,0.044922624504341056,0.5571428571428572,increased
656,Adding a Family Member to a Moderately Priced Dwelling Unit (MPDU) Deed during the Control Period.,0.0025530600682614536,0.6285714285714286,increased
657,Montgomery Housing Partnership (MHP),0.04734422550093023,0.757142857142857,increased
658,Office of the County Executive Location and Office Hours,0.022367189680572087,0.8,increased
659,COVID-19 Temporary DHCA Housing Inspection Protocol for Interior Complaints in Response to COVID-19,0.03678749787978613,0.8,increased
660,Refinancing a Moderately Priced Dwelling Unit (MPDU) During the Control Period,0.04328653727451644,0.8142857142857144,increased
661,Hours of Operation for the Board of Elections (BOE),0.03204781206496149,0.8571428571428572,increased
662,Town of Laytonsville,0.011894121122954376,0.8857142857142858,increased
663,Police Towing Complaints,0.009990684849755092,0.9,increased
664,Registering/Signing up for Investment Counseling,0.029399460726834657,0.9,increased
665,Accessory Dwelling Unit (ADU) Complaint,0.041416150486262744,0.9,increased
666,Utility Assistance for Public Housing or HOC (Housing Choice Voucher),0.03456865540063917,0.9142857142857143,increased
667,Simplifile,0.014956363910414203,1.0,increased
668,Change to In-Person Voting at Polling Station after Receiving an Absentee Ballot,0.014956363910414203,1.0,increased
669,Office of Health Care Quality Licensing and Exempt Building Issues,0.01138525507192989,1.0571428571428572,increased
670,AccessMCG (FIN Payroll) - Employee Unable to Complete Address Change Online,0.017438860908343328,1.1,increased
671,Tree Montgomery - Follow up from Site Visit,0.014643677184752882,1.1142857142857143,increased
672,Questions regarding Absentee Ballots for Military or individuals overseas,0.011964617739524319,1.1285714285714286,increased
673,Complaint Regarding a Telephone Bill,0.005121072764272635,1.2,increased
674,State of Maryland Medical Examiner,0.005121072764272635,1.2,increased
675,Employee - Vision Insurance Assistance,0.012992786487757368,1.2,increased
676,Absentee Ballot for General Election After Vote Via Absentee Ballot During Past Primary and/or General Elections,0.013275877464573012,1.3,increased
677,AccessMCG (FIN Payroll) - Temporary Login ID and Temporary Password Assistance,0.013275877464573012,1.3,increased
678,COVID-19 Quarantine Hotel,0.04500099771252722,1.3,increased
679,Employee - Request for Copy of Pay Advice (Payslip),0.004404838762275397,1.4,increased
680,"Current Active Employees' Change of Address, Phone Number or Emergency Contacts",0.006723515763058952,1.4,increased
681,AccessMCG (FIN Payroll) - Employees Viewing Pay Advice or Payslip,0.009106153759546399,1.5,increased
682,DPS Offices Closed for Walk-in Customers,0.018328392205591498,1.5,increased
683,COVID-19 Ride On Offering Face Covering Pilot Program,0.02985818217520561,1.5,increased
684,Public Assistance to Adults,0.04055190058308587,1.5142857142857142,increased
685,"General Information about Types of Stormwater Management BMPs (Ponds, Underground Structures, Dry Ponds, Wetlands, Detention Basins, LID, ESD, Bioretention)",0.004979322437633268,1.5571428571428572,increased
686,Stormwater Management on Private Residential Lots,0.0018694771170562289,1.5857142857142854,increased
687,Maryland Department of Education Division of Early Childhood (Child Care),0.0005367366369119512,1.6,increased
688,"Case Status, Office of Consumer Protection",0.04394807589239724,1.6714285714285715,increased
689,COVID-19 Curbside Pickup and Delivery Zones,0.013963451496507994,1.7,increased
690,COVID-19 Montgomery County Public School Community Messages,0.0012358639645822782,1.8,increased
691,Rental Assistance Program (RAP) Check or Benefit,0.010209635624403978,1.8571428571428572,increased
692,COVID-19 Transportation Updates,0.011879885594370202,1.9,increased
693,COVID-19 Emergency Closure Meals Service for MCPS Students,0.03434503548488308,2.0,increased
694,Employee - Request Copy of W-2 Form Not Received,0.003959385731141098,2.1,increased
695,"Hang Up, Dropped Cal or Wrong Number at ABS",0.029980500798727362,2.171428571428571,increased
696,Maryland Occupational Safety and Health (MOSH),0.018729654672763645,2.2,increased
697,Alcohol Beverage Services Licensee Questions,0.04247053760947851,2.228571428571428,increased
698,COVID-19 Office of County Attorney Update,0.0002559736583619996,2.3,increased
699,Alcohol Beverage Services Hours of Operation,0.024284935156809257,2.3,increased
700,COVID-19 New Employees Enrollment Information,0.011638368466420503,2.5,increased
701,Air Conditioning Requirements in Rental Townhome or Multi-Family Dwelling Unit,0.04197210798802424,2.6,increased
702,Nursing Home Licensing and Complaints,0.04457156018681977,2.628571428571429,increased
703,Food Assistance,0.03570544070953359,2.7,increased
704,"Complaint about Homeless Shelter, Hotel or Motel Issues",0.03206839881733725,2.814285714285714,increased
705,Report a Maintenance Problem in a Stormwater BMP or Pond,5.700280960366331e-05,2.9285714285714284,increased
706,"Retiree - Verification of ERS, RSP or GRIP Pensions",0.02967443656734251,2.942857142857144,increased
707,Definition of Accessory Dwelling Unit,0.00015787420125479412,3.0142857142857142,increased
708,Central Vendor Registration System (CVRS),0.04208551111967857,3.2428571428571424,increased
709,"Tree Permits, Removal, and Concerns.",0.004339370322755132,3.5,increased
710,Failure to Renew an Electrical License,0.004700152674496787,3.8428571428571425,increased
711,Residential Building Permit for Retaining Wall,0.023004665513524168,3.8857142857142852,increased
712,Adding a Family Member to a Property Deed Title,0.04007629214875912,3.8857142857142852,increased
713,Retiree - SilverScript Prescription Plan for Medicare Eligible Retirees,0.030668764868750264,4.185714285714287,increased
714,Reporting Maintenance Issues on School Property,0.019730330956356585,4.228571428571428,increased
715,"Food, Nutrition, Meals on Wheels (MOW), Senior Lunch Program",0.012864553088587558,4.314285714285714,increased
716,Moving Assistance or Storage - HHS,0.04039163076689154,4.4,increased
717,Minimum State Supplement Benefits and Food Stamps,0.013062682735283403,4.428571428571429,increased
718,Greater D.C. Diaper Bank,0.0001728401360376637,4.5,increased
719,Business Trash and Recycling Questions and Complaints,0.016796266672990612,4.5,increased
720,COVID-19 Residential Permit Parking Suspended,0.0012970265272987866,4.7,increased
721,Immunization Clinic Schedule for Children 2020 2021 School Year,0.028493124615367058,5.1,increased
722,Board of Elections Voter Services,0.011047578254103928,5.242857142857143,increased
723,Census 2020 Information and Employment Opportunities,0.024793018114375558,5.342857142857143,increased
724,Noise Complaint to the Police Department,0.0014599323492991353,6.071428571428571,increased
725,Siebel User Training,0.006598677899481601,6.114285714285715,increased
726,Reduced Cost Dental Care for Low Income Adults,0.0024362556057854648,6.3,increased
727,Residential Building Codes,9.025486607532481e-05,6.614285714285715,increased
728,Raising Chickens and Roosters,0.0015522364577662535,6.7,increased
729,Renewing an Electrical License Online,0.01850831921266513,6.828571428571427,increased
730,Driveway Apron Replacement,0.016327105708069296,7.614285714285715,increased
731,Board of Elections 2020 Elections and Early Voting,0.03275431807437015,7.7,increased
732,COVID-19 DHCA MPDU Program,0.0013790508802509341,7.9,increased
733,Income Support Case Manager; Supervisor or Office Complaint All Offices,0.005518210635277248,8.3,increased
734,eBox,0.04039163076689154,8.8,increased
735,COVID-19 Montgomery County Tax Payments and Internal Revenue Service (IRS) Filing Modifications,0.009462668638496314,9.1,increased
736,Assistance with Utility Disconnection - HHS,0.029652570628515253,9.2,increased
737,Health Care Eligibility Units  (formerly MAGI and SEU units) Request All Offices,0.0002281853305549886,9.22857142857143,increased
738,Fax Numbers for HHS Income Supports and Health Care Eligibility Offices,0.016171619687344953,9.828571428571427,increased
739,Absentee Ballot Application Status,0.014171584072909938,9.82857142857143,increased
740,Assistance with State or Federal Taxes,0.017917650273478896,9.885714285714288,increased
741,Specified Low Income Medicare Beneficiary or Qualified Medicare Beneficiary SLMB or QMB for all Public Assistance Offices,0.008386907395715116,10.057142857142857,increased
742,Permit Extension Fee,0.021579318495426096,10.328571428571426,increased
743,Homeless Information Line and Homeless Resources,0.01576332272447011,10.600000000000001,increased
744,Retiree - Prescription Insurance Inquiry,0.0001869168178787727,11.0,increased
745,Noise Complaint to the Department of Environmental Protection,0.041090449435243696,11.214285714285715,increased
746,COVID-19  Accessing Services for Homeless Individuals and Families,0.00020221778143050305,11.5,increased
747,Employee or Participating Agency- Verify Health Insurance Coverage,0.043684864798102165,12.1,increased
748,Employee or Retiree - Turning Age 65,0.04036985611268403,12.3,increased
749,Standards for Class 3 Accessory Dwelling Units,0.00032831582640120135,12.4,increased
750,Montgomery Cares Clinics for Low Income Adults,0.006778562065988995,12.442857142857143,increased
751,Recording Fees Associated With a Deed in Montgomery County,0.0007770005960640952,12.714285714285715,increased
752,Child Support Administration of Maryland,0.0001794209412255716,13.514285714285712,increased
753,COVID-19 Maryland Department of Health Frequently Asked Questions,0.02577815864515564,13.7,increased
754,"Death of a County Retiree, Active Employee or Dependent",0.031373795186433566,14.6,increased
755,United States Department of Labor Employment Call Center,0.00927037671870776,14.72857142857143,increased
756,Montgomery County Internal Revenue Service Office,0.04761353008103919,15.814285714285715,increased
757,Maternity Partnership Program Case Management and Education - Germantown,0.00010057753475900259,16.028571428571432,increased
758,Contact Montgomery County Government,0.013942157475046029,17.314285714285717,increased
759,6 Gallon Baby Blue Delivery,0.004368474721194288,17.371428571428574,increased
760,Contact a Landlord Tenant Investigator,3.903400192231932e-05,17.857142857142858,increased
761,COVID-19 Renter Relief Act,0.0017461080078359005,20.1,increased
762,Maternity Partnership Program Case Management and Education - Silver Spring,0.00013639167658916623,20.614285714285714,increased
763,Pregnant Woman In Need of Health Care,0.0011691399865101269,20.95714285714286,increased
764,Absentee Ballot Questions,0.01363932895979936,21.671428571428574,increased
765,Reporting Animal Complaints to the Office of Animal Services,0.005936758937734003,22.0,increased
766,First Month's Rent or Security Deposit - HHS,0.04067615132804202,22.1,increased
767,Ride On Real Time Accuracy,0.038964341869101846,22.371428571428567,increased
768,Process for Electrical License Renewal,7.359033841542304e-05,22.44285714285714,increased
769,Contact Case Manager 7300 Calhoun Place Income Support Office,0.004073843877934911,22.54285714285714,increased
770,Status of Health Care Eligibility Units Application  or How to Apply All Three Office Locations,4.529251900486571e-05,22.94285714285714,increased
771,"Permit Required for Fence, Deck or Shed",0.03653174201012279,24.942857142857143,increased
772,How to Request an Absentee Ballot Application,0.010378498612243195,25.885714285714286,increased
773,311 Call Centers Outside Maryland,0.0031886901853037867,27.714285714285715,increased
774,"Board of Elections Location, Mailing Address, and Business Hours",0.009448627332263008,28.357142857142858,increased
775,COVID-19 Evictions and Utility Disconnections Suspended,0.00597375522594164,28.8,increased
776,COVID-19 Report Violations of Maryland Governor's Emergency Orders to the Montgomery County Police,0.0031515010897964855,29.5,increased
777,Applying for the Rental Assistance Program or Status of an Application,0.0036331191328284967,30.84285714285715,increased
778,HELP Non Profit Community Groups,0.007506501608148193,33.0,increased
779,Contact MANNA and How to Make a Donation to MANNA,0.04634711360665777,35.614285714285714,increased
