,service_type,p-value,direction,inc/dec
780,Obtain a Tax Clearance Certificate,0.004702037272735648,36.285714285714285,increased
781,"COVID-19 Maryland Health Connection Special Enrollment Period Through July 15, 2020",0.0029308207182043903,36.6,increased
782,Montgomery County Public Schools Contact Information,0.0001265602092379885,44.1,increased
783,State of Maryland Information Center,0.008028686878248805,48.057142857142864,increased
784,Birth Death Marriage or Divorce Certificates,5.651527122505523e-07,53.785714285714285,increased
785,Motor Vehicle Administration (MVA),0.0012556381855161724,55.900000000000006,increased
786,COVID-19 Phase Two Reopening,0.03159277923150974,56.2,increased
787,COVID-19 2021 Rental Housing Licensing Renewal and Common Ownership Communities (COC) Annual Registration on Hold,0.008547113233640517,57.9,increased
788,Personal Property Tax Bills,0.0002828786796489366,60.64285714285714,increased
789,Request County to Plant a Tree,0.011030698640232393,60.91428571428572,increased
790,Reconsideration Recertification or Redetermination for Public Assistance Benefits,0.0007948500851307609,65.28571428571429,increased
791,COVID-19 Resources for Businesses,0.0043197569127641985,71.6,increased
792,HIV or STD Testing Information and Resources,2.1545028109188413e-05,78.0,increased
793,Cancel Recycling & Refuse Service Request,3.686375088725946e-09,81.97142857142858,increased
794,COVID-19 Governor Hogan Executive Orders for Maryland,0.04911602235201743,90.0,increased
795,COVID-19 Ride On Temporary Free Bus Service and Boarding Changes,0.04707179849176677,98.8,increased
796,"COVID-19 Restaurant, Bars, Theater, Gyms and other Businesses Licensed by Public Health Services License and Regulatory office",0.0004578804951110961,103.5,increased
797,MANNA Food Center Referral,0.0098575812630021,114.80000000000001,increased
798,Permit Status,0.007127956140239014,115.98571428571438,increased
799,COVID-19 Food Access Call Center,0.0016909390221906458,121.0,increased
800,35 Gallon Cart Delivery,6.939246695026919e-06,124.04285714285714,increased
801,Missed Collection,4.7195327599843324e-08,125.88571428571427,increased
802,Contact Income Supports Case Manager Silver Spring,0.0015056819991046118,134.34285714285713,increased
803,Electronic Benefits Transfer (EBT) Card Information for Public Assistance Benefits,0.0006255361871406834,141.64285714285714,increased
804,65 Gallon Cart Delivery,3.343632670712469e-08,141.85714285714286,increased
805,COVID-19 Health Care Eligibility Units or County Safety Net Programs,0.0001402944338695674,148.8,increased
806,"Unemployment Information through the Maryland State Department of Labor, Licensing and Regulation",0.002250918875602376,150.31428571428572,increased
807,"Status of Tree Prune, Stump or Removal",3.0698589426912494e-05,159.34285714285713,increased
808,Contact Income Supports Case Manager Rockville,0.012388896313062867,184.3,increased
809,COVID-19 Testing for Coronavirus COVID-19,0.019630776465716624,187.9,increased
810,eServices (ePermit and ePlans),2.014574980277722e-05,202.0,increased
811,COVID-19 Testing for Coronavirus,0.0218368337109338,221.9,increased
812,COVID-19 Coronavirus General Information,0.006709399032649606,231.5,increased
813,"How to Apply for Public Assistance Programs, and Obtain and Application: Medicaid or Medical Assistance, Food Stamps, Cash Assistance Including Temporary  Disability Assistance and Temporary Cash Assistance",0.03610506761276727,256.3,increased
814,"How to Apply for Public Assistance Programs: Medicaid or Medical Assistance, Food Stamps, Cash Assistance Including Temporary  Disability Assistance and Temporary Cash Assistance",0.041771101758048775,260.48571428571427,increased
815,Unacceptable for Collection - Recycling & Refuse Services,0.00028066939018417825,319.6,increased
816,Same Day,2.21103384552833e-08,332.7142857142857,increased
817,State of Maryland Customer Call Center for Department of Human Services,0.001790834930675183,333.35714285714283,increased
818,Contact Income Supports Case Manager Germantown,0.00014359301808728082,339.24285714285713,increased
819,Apply for office of Home Energy Programs or check Status of New Application or Recertification,0.0037523283816651974,367.8285714285714,increased
820,Field Check,3.500406538317089e-06,389.7857142857143,increased
821,COVID-19 Ride On Bus Service Reductions,0.017303911088966385,399.6,increased
822,Cart Repair,9.826108688246469e-07,452.3285714285714,increased
823,Transfer Station Questions,0.04713515320162557,478.1714285714286,increased
824,"COVID-19 Closures, Service Modifications and Cancellations in Montgomery County",0.0005327852195891981,491.0,increased
825,Status of Income Support Benefits Case - New Application or Recertification,9.109320508262807e-06,548.7571428571429,increased
826,22 Gallon Bin Pick-up,1.338288488442245e-07,656.1142857142856,increased
827,Scrap Metal Pick-Up Request,0.0008070869030858903,930.1285714285714,increased
828,Bulk Trash Pick-Up Request,9.257405480725349e-06,1149.6857142857143,increased
829,COVID-19 Rental Relief Program HHS,0.0004432261107919504,1217.9,increased
830,22 Gallon Bin Delivery,6.305227675096868e-07,2029.4285714285716,increased
